From	Entry	Entry Name	Protein names	Gene Names	Organism	Length	Function [CC]	Pathway	Developmental stage	Tissue specificity	Gene Ontology (GO)	Gene Ontology IDs
PKS1_ARATH	Q9SWI1	PKS1_ARATH	Protein PHYTOCHROME KINASE SUBSTRATE 1	PKS1 At2g02950 T17M13.12	Arabidopsis thaliana (Mouse-ear cress)	439	FUNCTION: May be responsible for light-regulated cytoplasmic sequestration of phytochromes or may be a negative regulator of phytochrome B signaling. Component of the network that modulates the very low-fluence response (VLFR) branch of phyA signaling. Acts positively in PHOT1 signaling. Regulates phytochrome-mediated photomorphogenesis and hypocotyl phototropism. Involved in the control of leaf flattening and leaf positioning. Promotes negative root phototropism and negatively regulates root gravitropism. May act by controlling auxin homeostasis. {ECO:0000269|PubMed:10348744, ECO:0000269|PubMed:14615593, ECO:0000269|PubMed:16777956, ECO:0000269|PubMed:18024556, ECO:0000269|PubMed:20071603}.		DEVELOPMENTAL STAGE: Decreases with development. {ECO:0000269|PubMed:10348744}.	TISSUE SPECIFICITY: Expressed in young seedlings in both darkness and light. Moderate in leaves and very low in roots and flowers. Expressed in the elongation zone of the root and hypocotyl. {ECO:0000269|PubMed:10348744, ECO:0000269|PubMed:14615593, ECO:0000269|PubMed:16777956, ECO:0000269|PubMed:18024556}.	cytoplasm [GO:0005737]; plasma membrane [GO:0005886]; phototropism [GO:0009638]; positive gravitropism [GO:0009958]; red or far-red light signaling pathway [GO:0010017]; red, far-red light phototransduction [GO:0009585]; response to far red light [GO:0010218]; response to red light [GO:0010114]	GO:0005737; GO:0005886; GO:0009585; GO:0009638; GO:0009958; GO:0010017; GO:0010114; GO:0010218
IAA16_ARATH	O24407	IAA16_ARATH	Auxin-responsive protein IAA16 (Indoleacetic acid-induced protein 16)	IAA16 At3g04730 F7O18.22	Arabidopsis thaliana (Mouse-ear cress)	236	FUNCTION: Aux/IAA proteins are short-lived transcriptional factors that function as repressors of early auxin response genes at low auxin concentrations. Repression is thought to result from the interaction with auxin response factors (ARFs), proteins that bind to the auxin-responsive promoter element (AuxRE). Formation of heterodimers with ARF proteins may alter their ability to modulate early auxin response genes expression. {ECO:0000269|PubMed:12036262}.				nucleus [GO:0005634]; DNA-binding transcription factor activity [GO:0003700]; identical protein binding [GO:0042802]; transcription cis-regulatory region binding [GO:0000976]; auxin-activated signaling pathway [GO:0009734]; response to auxin [GO:0009733]	GO:0000976; GO:0003700; GO:0005634; GO:0009733; GO:0009734; GO:0042802
RTOR1_ARATH	Q93YQ1	RTOR1_ARATH	Regulatory-associated protein of TOR 1 (Protein RAPTOR 1) (Protein RAPTOR 1B) (AtRaptor1b)	RAPTOR1 RAPTOR1B At3g08850 T16O11.22	Arabidopsis thaliana (Mouse-ear cress)	1344	FUNCTION: Probable component of the plant TOR kinase pathway that recruits substrates for TOR. Modulates plant cell growth and regulates the activity of ATPK1 kinase in response to osmotic stress. {ECO:0000269|PubMed:16377759}.			TISSUE SPECIFICITY: Expressed in roots, leaves, flowers and seeds. {ECO:0000269|PubMed:15607746}.	Cul4-RING E3 ubiquitin ligase complex [GO:0080008]; cytoplasm [GO:0005737]; TORC1 complex [GO:0031931]; kinase binding [GO:0019900]; protein-macromolecule adaptor activity [GO:0030674]; cellular response to amino acid stimulus [GO:0071230]; cellular response to starvation [GO:0009267]; embryo development ending in seed dormancy [GO:0009793]; maintenance of shoot apical meristem identity [GO:0010492]; negative regulation of autophagy [GO:0010507]; positive regulation of cell growth [GO:0030307]; positive regulation of protein serine/threonine kinase activity [GO:0071902]; regulation of autophagy [GO:0010506]; TOR signaling [GO:0031929]	GO:0005737; GO:0009267; GO:0009793; GO:0010492; GO:0010506; GO:0010507; GO:0019900; GO:0030307; GO:0030674; GO:0031929; GO:0031931; GO:0071230; GO:0071902; GO:0080008
RTOR1_ORYSJ	C7J8E5	RTOR1_ORYSJ	Regulatory-associated protein of TOR 1 (Protein RAPTOR 1) (OsRAPTOR1)	RAPTOR1 Os11g0109933 LOC_Os11g01872	Oryza sativa subsp. japonica (Rice)	1218	FUNCTION: Component of TORC1 complex, which is an essential cell growth regulator that controls plant development. Acts by recruiting substrates for TOR. Acts by activating transcription, protein synthesis and ribosome biogenesis, and inhibiting mRNA degradation and autophagy. {ECO:0000305|PubMed:25956502}.				cytoplasm [GO:0005737]; TORC1 complex [GO:0031931]; protein-macromolecule adaptor activity [GO:0030674]; cellular response to amino acid stimulus [GO:0071230]; cellular response to starvation [GO:0009267]; positive regulation of cell growth [GO:0030307]; positive regulation of protein serine/threonine kinase activity [GO:0071902]; regulation of autophagy [GO:0010506]; TOR signaling [GO:0031929]	GO:0005737; GO:0009267; GO:0010506; GO:0030307; GO:0030674; GO:0031929; GO:0031931; GO:0071230; GO:0071902
UBIQ_AVESA	P69310	UBIQ_AVESA	Ubiquitin		Avena sativa (Oat)	76	FUNCTION: Ubiquitin exists either covalently attached to another protein, or free (unanchored). When covalently bound, it is conjugated to target proteins via an isopeptide bond either as a monomer (monoubiquitin), a polymer linked via different Lys residues of the ubiquitin (polyubiquitin chains) or a linear polymer linked via the initiator Met of the ubiquitin (linear polyubiquitin chains). Polyubiquitin chains, when attached to a target protein, have different functions depending on the Lys residue of the ubiquitin that is linked: Lys-48-linked is involved in protein degradation via the proteasome. Linear polymer chains formed via attachment by the initiator Met lead to cell signaling. Ubiquitin is usually conjugated to Lys residues of target proteins, however, in rare cases, conjugation to Cys or Ser residues has been observed. When polyubiquitin is free (unanchored-polyubiquitin), it also has distinct roles, such as in activation of protein kinases, and in signaling (By similarity). {ECO:0000250}.				cytoplasm [GO:0005737]; nucleus [GO:0005634]; mRNA binding [GO:0003729]	GO:0003729; GO:0005634; GO:0005737
UBIQP_HORVU	P0CG83	UBIQP_HORVU	Polyubiquitin [Cleaved into: Ubiquitin]		Hordeum vulgare (Barley)	171	FUNCTION: Ubiquitin exists either covalently attached to another protein, or free (unanchored). When covalently bound, it is conjugated to target proteins via an isopeptide bond either as a monomer (monoubiquitin), a polymer linked via different Lys residues of the ubiquitin (polyubiquitin chains) or a linear polymer linked via the initiator Met of the ubiquitin (linear polyubiquitin chains). Polyubiquitin chains, when attached to a target protein, have different functions depending on the Lys residue of the ubiquitin that is linked: Lys-6-linked may be involved in DNA repair; Lys-11-linked is involved in ERAD (endoplasmic reticulum-associated degradation) and in cell-cycle regulation; Lys-29-linked is involved in lysosomal degradation; Lys-33-linked is involved in kinase modification; Lys-48-linked is involved in protein degradation via the proteasome; Lys-63-linked is involved in endocytosis, DNA-damage responses as well as in signaling processes leading to activation of the transcription factor NF-kappa-B. Linear polymer chains formed via attachment by the initiator Met lead to cell signaling. Ubiquitin is usually conjugated to Lys residues of target proteins, however, in rare cases, conjugation to Cys or Ser residues has been observed. When polyubiquitin is free (unanchored-polyubiquitin), it also has distinct roles, such as in activation of protein kinases, and in signaling (By similarity). {ECO:0000250}.				cytoplasm [GO:0005737]; nucleus [GO:0005634]; mRNA binding [GO:0003729]	GO:0003729; GO:0005634; GO:0005737
PTR14_ARATH	Q9LQL2	PTR14_ARATH	Protein NRT1/ PTR FAMILY 7.3 (AtNPF7.3) (Nitrate transporter 1.5)	NPF7.3 NRT1.5 At1g32450 F5D14.23	Arabidopsis thaliana (Mouse-ear cress)	614	FUNCTION: Low-affinity proton-dependent bidirectional nitrate transporter. Involved in nitrate loading into xylem and not in nitrate uptake. Not involved in histidine or dipeptides transport. {ECO:0000269|PubMed:18780802}.			TISSUE SPECIFICITY: High expression in roots. Barely detected in shoots. Expressed in root pericycle cells close to the xylem. {ECO:0000269|PubMed:17481610, ECO:0000269|PubMed:18780802, ECO:0000269|PubMed:20501909}.	membrane [GO:0016020]; plasma membrane [GO:0005886]; nitrate transmembrane transporter activity [GO:0015112]; potassium:proton antiporter activity [GO:0015386]; symporter activity [GO:0015293]; transmembrane transporter activity [GO:0022857]; leaf senescence [GO:0010150]; nitrate transmembrane transport [GO:0015706]; potassium ion homeostasis [GO:0055075]; proton transmembrane transport [GO:1902600]; response to nitrate [GO:0010167]; transmembrane transport [GO:0055085]	GO:0005886; GO:0010150; GO:0010167; GO:0015112; GO:0015293; GO:0015386; GO:0015706; GO:0016020; GO:0022857; GO:0055075; GO:0055085; GO:1902600
PPO2_IPOBA	Q9MB14	PPO2_IPOBA	Polyphenol oxidase II, chloroplastic (PPO-II) (EC 1.10.3.1) (Catechol oxidase II)	co-2 ppo-I	Ipomoea batatas (Sweet potato) (Convolvulus batatas)	588	FUNCTION: Catalyzes the oxidation of mono- and o-diphenols to o-diquinones. {ECO:0000250}.				chloroplast thylakoid lumen [GO:0009543]; catechol oxidase activity [GO:0004097]; metal ion binding [GO:0046872]; pigment biosynthetic process [GO:0046148]	GO:0004097; GO:0009543; GO:0046148; GO:0046872
PLCD2_ARATH	Q39033	PLCD2_ARATH	Phosphoinositide phospholipase C 2 (EC 3.1.4.11) (Phosphoinositide phospholipase PLC2) (AtPLC2) (PI-PLC2)	PLC2 At3g08510 T8G24.4	Arabidopsis thaliana (Mouse-ear cress)	581	FUNCTION: The production of the second messenger molecules diacylglycerol (DAG) and inositol 1,4,5-trisphosphate (IP3) is mediated by activated phosphatidylinositol-specific phospholipase C enzymes. At physiological calcium concentration, the preferred substrate is phosphatidylinositol 4,5-bisphosphate versus phosphatidylinositol. {ECO:0000269|PubMed:11377433, ECO:0000269|Ref.10}.			TISSUE SPECIFICITY: Expressed in roots, shoots, leaves and flowers. {ECO:0000269|PubMed:9177324, ECO:0000269|Ref.10}.	plasma membrane [GO:0005886]; phosphatidylinositol phospholipase C activity [GO:0004435]; phospholipase C activity [GO:0004629]; defense response to bacterium [GO:0042742]; embryo sac development [GO:0009553]; floral organ development [GO:0048437]; lipid catabolic process [GO:0016042]; microsporogenesis [GO:0009556]; phosphatidylinositol-mediated signaling [GO:0048015]; positive regulation of auxin biosynthetic process [GO:0010601]; release of sequestered calcium ion into cytosol [GO:0051209]	GO:0004435; GO:0004629; GO:0005886; GO:0009553; GO:0009556; GO:0010601; GO:0016042; GO:0042742; GO:0048015; GO:0048437; GO:0051209
NLTP2_PRUAR	P82353	NLTP2_PRUAR	Non-specific lipid-transfer protein 2 (LTP 2)		Prunus armeniaca (Apricot) (Armeniaca vulgaris)	68	FUNCTION: Plant non-specific lipid-transfer proteins transfer phospholipids as well as galactolipids across membranes. May play a role in wax or cutin deposition in the cell walls of expanding epidermal cells and certain secretory tissues (By similarity). {ECO:0000250}.				lipid binding [GO:0008289]; lipid transport [GO:0006869]	GO:0006869; GO:0008289
XTH29_ARATH	Q8L7H3	XTH29_ARATH	Probable xyloglucan endotransglucosylase/hydrolase protein 29 (At-XTH29) (XTH-29) (EC 2.4.1.207)	XTH29 XTR13 At4g18990 F13C5.160	Arabidopsis thaliana (Mouse-ear cress)	357	FUNCTION: Catalyzes xyloglucan endohydrolysis (XEH) and/or endotransglycosylation (XET). Cleaves and religates xyloglucan polymers, an essential constituent of the primary cell wall, and thereby participates in cell wall construction of growing tissues (By similarity). {ECO:0000250}.				apoplast [GO:0048046]; hydrolase activity, hydrolyzing O-glycosyl compounds [GO:0004553]; polysaccharide binding [GO:0030247]; xyloglucan:xyloglucosyl transferase activity [GO:0016762]; cell wall biogenesis [GO:0042546]; cell wall organization [GO:0071555]; xyloglucan metabolic process [GO:0010411]	GO:0004553; GO:0010411; GO:0016762; GO:0030247; GO:0042546; GO:0048046; GO:0071555
XTH30_ARATH	Q38908	XTH30_ARATH	Probable xyloglucan endotransglucosylase/hydrolase protein 30 (At-XTH30) (XTH-30) (EC 2.4.1.207)	XTH30 XTR4 At1g32170 F3C3.5	Arabidopsis thaliana (Mouse-ear cress)	343	FUNCTION: Catalyzes xyloglucan endohydrolysis (XEH) and/or endotransglycosylation (XET). Cleaves and religates xyloglucan polymers, an essential constituent of the primary cell wall, and thereby participates in cell wall construction of growing tissues (By similarity). {ECO:0000250}.			TISSUE SPECIFICITY: Predominantly expressed in green siliques. {ECO:0000269|PubMed:11673616}.	apoplast [GO:0048046]; hydrolase activity, hydrolyzing O-glycosyl compounds [GO:0004553]; polysaccharide binding [GO:0030247]; xyloglucan:xyloglucosyl transferase activity [GO:0016762]; cell wall biogenesis [GO:0042546]; cell wall organization [GO:0071555]; xyloglucan metabolic process [GO:0010411]	GO:0004553; GO:0010411; GO:0016762; GO:0030247; GO:0042546; GO:0048046; GO:0071555
ACR10_ARATH	Q9SJM1	ACR10_ARATH	ACT domain-containing protein ACR10 (Protein ACT DOMAIN REPEATS 10)	ACR10 At2g36840	Arabidopsis thaliana (Mouse-ear cress)	410	FUNCTION: May bind amino acids. {ECO:0000303|PubMed:21861936}.					
ACR9_ARATH	O80644	ACR9_ARATH	ACT domain-containing protein ACR9 (Protein ACT DOMAIN REPEATS 9)	ACR9 At2g39570	Arabidopsis thaliana (Mouse-ear cress)	411	FUNCTION: May bind amino acids. {ECO:0000303|PubMed:21861936}.					
IAA4_ARATH	P33077	IAA4_ARATH	Auxin-responsive protein IAA4 (Auxin-induced protein AUX2-11) (Indoleacetic acid-induced protein 4)	IAA4 AUX2-11 At5g43700 MQD19.3	Arabidopsis thaliana (Mouse-ear cress)	186	FUNCTION: Aux/IAA proteins are short-lived transcriptional factors that function as repressors of early auxin response genes at low auxin concentrations. Repression is thought to result from the interaction with auxin response factors (ARFs), proteins that bind to the auxin-responsive promoter element (AuxRE). Formation of heterodimers with ARF proteins may alter their ability to modulate early auxin response genes expression. {ECO:0000269|PubMed:12036262}.			TISSUE SPECIFICITY: Preferentially expressed in stems, leaves and flowers. {ECO:0000269|PubMed:7658471}.	nucleus [GO:0005634]; DNA binding [GO:0003677]; DNA-binding transcription factor activity [GO:0003700]; identical protein binding [GO:0042802]; transcription cis-regulatory region binding [GO:0000976]; auxin-activated signaling pathway [GO:0009734]; response to auxin [GO:0009733]	GO:0000976; GO:0003677; GO:0003700; GO:0005634; GO:0009733; GO:0009734; GO:0042802
BH112_ARATH	Q94JL3	BH112_ARATH	Transcription factor bHLH112 (Basic helix-loop-helix protein 112) (AtbHLH112) (bHLH 112) (Transcription factor EN 64) (bHLH transcription factor bHLH112)	BHLH112 EN64 At1g61660 T13M11.1	Arabidopsis thaliana (Mouse-ear cress)	393					nucleus [GO:0005634]; DNA-binding transcription factor activity [GO:0003700]; DNA-binding transcription factor activity, RNA polymerase II-specific [GO:0000981]; protein dimerization activity [GO:0046983]; RNA polymerase II cis-regulatory region sequence-specific DNA binding [GO:0000978]; sequence-specific DNA binding [GO:0043565]; cellular response to abscisic acid stimulus [GO:0071215]; cellular response to salt stress [GO:0071472]; cellular response to water deprivation [GO:0042631]; positive regulation of DNA-templated transcription [GO:0045893]; regulation of proline metabolic process [GO:2000214]; regulation of reactive oxygen species metabolic process [GO:2000377]; regulation of transcription by RNA polymerase II [GO:0006357]	GO:0000978; GO:0000981; GO:0003700; GO:0005634; GO:0006357; GO:0042631; GO:0043565; GO:0045893; GO:0046983; GO:0071215; GO:0071472; GO:2000214; GO:2000377
ACR1_ARATH	Q9FHP1	ACR1_ARATH	ACT domain-containing protein ACR1 (Protein ACT DOMAIN REPEATS 1)	ACR1 At5g65890 F6H11.30 K14B20.6	Arabidopsis thaliana (Mouse-ear cress)	477	FUNCTION: May bind amino acids. {ECO:0000303|PubMed:12481063}.			TISSUE SPECIFICITY: Expressed in flowers and siliques. {ECO:0000269|PubMed:12481063}.	nucleus [GO:0005634]; amino acid binding [GO:0016597]	GO:0005634; GO:0016597
CKX6_ARATH	Q9LY71	CKX6_ARATH	Cytokinin dehydrogenase 6 (EC 1.5.99.12) (Cytokinin oxidase 6) (AtCKX6) (AtCKX7) (CKO6)	CKX6 CKX7 At3g63440 MAA21_70	Arabidopsis thaliana (Mouse-ear cress)	533	FUNCTION: Catalyzes the oxidation of cytokinins, a family of N(6)-substituted adenine derivatives that are plant hormones, where the substituent is an isopentenyl group. {ECO:0000269|PubMed:14555694}.		DEVELOPMENTAL STAGE: Expressed during the maturation phase of stomatal guard cells but not in fully mature stomata. In the root vasculature, detected soon after germination, with a maxima around the lateral root primordia. {ECO:0000269|PubMed:14555694}.	TISSUE SPECIFICITY: Expressed in the vascular system of roots, of young growing leaves and of the most apical portion of the growing stem. No expression in the root apical meristem. In flowers, restricted to the vascular bundles and transmitting tissue of developing gynoeciae. {ECO:0000269|PubMed:14555694}.	extracellular space [GO:0005615]; cytokinin dehydrogenase activity [GO:0019139]; FAD binding [GO:0071949]; oxidoreductase activity [GO:0016491]; cytokinin metabolic process [GO:0009690]; stomatal complex morphogenesis [GO:0010103]	GO:0005615; GO:0009690; GO:0010103; GO:0016491; GO:0019139; GO:0071949
BRG1_ARATH	Q9FHE4	BRG1_ARATH	BOI-related E3 ubiquitin-protein ligase 1 (EC 2.3.2.27) (RING-type E3 ubiquitin transferase BRG1)	BRG1 At5g45100 K17O22.9	Arabidopsis thaliana (Mouse-ear cress)	294	FUNCTION: E3 ubiquitin-protein ligase involved in regulation of abiotic stress responses. Not involved in ubiquitination of MYB108/BOS1. Has no effect on the stability of the DELLA proteins. {ECO:0000269|PubMed:20921156, ECO:0000269|PubMed:23482857}.	PATHWAY: Protein degradation; proteasomal ubiquitin-dependent pathway.			metal ion binding [GO:0046872]; ubiquitin-protein transferase activity [GO:0004842]; defense response [GO:0006952]; proteasome-mediated ubiquitin-dependent protein catabolic process [GO:0043161]; regulation of programmed cell death [GO:0043067]	GO:0004842; GO:0006952; GO:0043067; GO:0043161; GO:0046872
CPR1_ARATH	Q9SU30	CPR1_ARATH	F-box protein CPR1 (Protein CONSTITUTIVE EXPRESSER OF PR GENES 1) (Protein CONSTITUTIVE EXPRESSER OF PR GENES 30)	CPR1 CPR30 At4g12560 T1P17.150	Arabidopsis thaliana (Mouse-ear cress)	413	FUNCTION: Component of SCF(ASK-cullin-F-box) E3 ubiquitin ligase complexes, which may mediate the ubiquitination and subsequent proteasomal degradation of target proteins (By similarity). Regulates negatively both salicylic acid (SA)-dependent and SA-independent defense signaling. {ECO:0000250, ECO:0000269|PubMed:19682297}.	PATHWAY: Protein modification; protein ubiquitination.		TISSUE SPECIFICITY: Expressed in seedling, root, stem, leaves, inflorescence and silique, especially in veins and trichomes. {ECO:0000269|PubMed:19682297}.	cytoplasm [GO:0005737]; nucleus [GO:0005634]; negative regulation of defense response [GO:0031348]; negative regulation of protein catabolic process [GO:0042177]; plant-type hypersensitive response [GO:0009626]; protein ubiquitination [GO:0016567]	GO:0005634; GO:0005737; GO:0009626; GO:0016567; GO:0031348; GO:0042177
FB135_ARATH	Q9SFC7	FB135_ARATH	F-box protein At3g07870	At3g07870 F17A17.21	Arabidopsis thaliana (Mouse-ear cress)	417					plasmodesma [GO:0009506]; positive regulation of cell population proliferation [GO:0008284]	GO:0008284; GO:0009506
CRD1_GOSHI	Q6SJV8	CRD1_GOSHI	Magnesium-protoporphyrin IX monomethyl ester [oxidative] cyclase, chloroplastic (Mg-protoporphyrin IX monomethyl ester oxidative cyclase) (EC 1.14.13.81)	CRD1 ZIP	Gossypium hirsutum (Upland cotton) (Gossypium mexicanum)	405	FUNCTION: Catalyzes the formation of the isocyclic ring in chlorophyll biosynthesis. Mediates the cyclase reaction, which results in the formation of divinylprotochlorophyllide (Pchlide) characteristic of all chlorophylls from magnesium-protoporphyrin IX 13-monomethyl ester (MgPMME) (By similarity). {ECO:0000250}.	PATHWAY: Porphyrin-containing compound metabolism; chlorophyll biosynthesis.			chloroplast thylakoid membrane [GO:0009535]; magnesium-protoporphyrin IX monomethyl ester (oxidative) cyclase activity [GO:0048529]; metal ion binding [GO:0046872]; chlorophyll biosynthetic process [GO:0015995]; photosynthesis [GO:0015979]	GO:0009535; GO:0015979; GO:0015995; GO:0046872; GO:0048529
SDR1_ARATH	Q9M2E2	SDR1_ARATH	(+)-neomenthol dehydrogenase (EC 1.1.1.-) (EC 1.1.1.208) (Menthone:neomenthol reductase) (Short-chain dehydrogenase/reductase 1) (AtSDR1)	SDR1 At3g61220 T20K12.120	Arabidopsis thaliana (Mouse-ear cress)	296	FUNCTION: Aldehyde reductase that catalyzes the reduction of the aldehyde carbonyl groups on saturated and alpha,beta-unsaturated aldehydes with more than 5 carbons (PubMed:21169366). Involved in basal resistance against pathogens. {ECO:0000269|PubMed:18599651, ECO:0000269|PubMed:21169366}.				cytoplasm [GO:0005737]; (+)-neomenthol dehydrogenase activity [GO:0047501]; defense response [GO:0006952]	GO:0005737; GO:0006952; GO:0047501
XTH15_ARATH	Q38911	XTH15_ARATH	Xyloglucan endotransglucosylase/hydrolase protein 15 (At-XTH15) (XTH-15) (EC 2.4.1.207) (EC 3.2.1.151)	XTH15 XTR7 At4g14130 dl3105c FCAALL.173	Arabidopsis thaliana (Mouse-ear cress)	289	FUNCTION: Catalyzes xyloglucan endohydrolysis (XEH) and/or endotransglycosylation (XET). Cleaves and religates xyloglucan polymers, an essential constituent of the primary cell wall, and thereby participates in cell wall construction of growing tissues. Has a high XET activity, but little or no XEH activity in vitro. Acceptor preferences are XXXGol > XLLGol = XLFGol > XXLGol > XXFGol. {ECO:0000269|PubMed:25446234}.			TISSUE SPECIFICITY: Strongly expressed in roots, hypocotyls and cotyledons. Aslo detected in inflorescence stems and in the carpels and styles in flowers. {ECO:0000269|PubMed:16830179}.	apoplast [GO:0048046]; polysaccharide binding [GO:0030247]; xyloglucan-specific endo-beta-1,4-glucanase activity [GO:0033946]; xyloglucan:xyloglucosyl transferase activity [GO:0016762]; cell wall biogenesis [GO:0042546]; cell wall organization [GO:0071555]; response to far red light [GO:0010218]; xyloglucan metabolic process [GO:0010411]	GO:0010218; GO:0010411; GO:0016762; GO:0030247; GO:0033946; GO:0042546; GO:0048046; GO:0071555
HIP9_ARATH	Q9FLU5	HIP9_ARATH	Heavy metal-associated isoprenylated plant protein 9 (AtHIP09)	HIPP09 At5g24580 K18P6.11	Arabidopsis thaliana (Mouse-ear cress)	319	FUNCTION: Heavy-metal-binding protein. {ECO:0000250|UniProtKB:Q9LZF1}.				metal ion binding [GO:0046872]	GO:0046872
HSPR2_ARATH	O04203	HSPR2_ARATH	Nematode resistance protein-like HSPRO2 (AKINbetagamma-interacting protein 2) (Ortholog of sugar beet HS1 PRO-1 protein 2) (Protein Hs1pro-2)	HSPRO2 At2g40000 T28M21.16	Arabidopsis thaliana (Mouse-ear cress)	435	FUNCTION: Positive regulator of basal resistance. {ECO:0000269|PubMed:17977154}.				cytoplasm [GO:0005737]; heme binding [GO:0020037]; metal ion binding [GO:0046872]; cellular response to hypoxia [GO:0071456]; defense response to bacterium [GO:0042742]; response to oxidative stress [GO:0006979]; response to salicylic acid [GO:0009751]; tryptophan catabolic process to kynurenine [GO:0019441]	GO:0005737; GO:0006979; GO:0009751; GO:0019441; GO:0020037; GO:0042742; GO:0046872; GO:0071456
CML42_ARATH	Q9SVG9	CML42_ARATH	Calcium-binding protein CML42 (Calmodulin-like protein 42)	CML42 At4g20780 F21C20.130	Arabidopsis thaliana (Mouse-ear cress)	191	FUNCTION: Probable calcium sensor that binds calcium in vitro. Involved in the regulation of trichome branching. {ECO:0000269|PubMed:16240180, ECO:0000269|PubMed:19720824}.			TISSUE SPECIFICITY: Expressed in seedling shoots, roots, rosette leaves and flowers. Expressed in the leaf trichome support cells. {ECO:0000269|PubMed:16240180, ECO:0000269|PubMed:19720824}.	calcium ion binding [GO:0005509]; trichome branching [GO:0010091]	GO:0005509; GO:0010091
FRI1_ARATH	Q39101	FRI1_ARATH	Ferritin-1, chloroplastic (AtFer1) (EC 1.16.3.1)	FER1 At5g01600 F7A7.120	Arabidopsis thaliana (Mouse-ear cress)	255	FUNCTION: Stores iron in a soluble, non-toxic, readily available form. Important for iron homeostasis. Has ferroxidase activity. Iron is taken up in the ferrous form and deposited as ferric hydroxides after oxidation (By similarity). {ECO:0000250}.				chloroplast [GO:0009507]; chloroplast stroma [GO:0009570]; chloroplast thylakoid membrane [GO:0009535]; cytoplasm [GO:0005737]; mitochondrion [GO:0005739]; plasma membrane [GO:0005886]; thylakoid [GO:0009579]; ferric iron binding [GO:0008199]; ferrous iron binding [GO:0008198]; ferroxidase activity [GO:0004322]; identical protein binding [GO:0042802]; iron ion binding [GO:0005506]; protein domain specific binding [GO:0019904]; flower development [GO:0009908]; intracellular sequestering of iron ion [GO:0006880]; iron ion transport [GO:0006826]; leaf development [GO:0048366]; photosynthesis [GO:0015979]; response to bacterium [GO:0009617]; response to cold [GO:0009409]; response to hydrogen peroxide [GO:0042542]; response to iron ion [GO:0010039]; response to reactive oxygen species [GO:0000302]; response to zinc ion [GO:0010043]	GO:0000302; GO:0004322; GO:0005506; GO:0005737; GO:0005739; GO:0005886; GO:0006826; GO:0006880; GO:0008198; GO:0008199; GO:0009409; GO:0009507; GO:0009535; GO:0009570; GO:0009579; GO:0009617; GO:0009908; GO:0010039; GO:0010043; GO:0015979; GO:0019904; GO:0042542; GO:0042802; GO:0048366
