From	Entry	Entry Name	Protein names	Gene Names	Organism	Length	Function [CC]	Pathway	Developmental stage	Tissue specificity	Gene Ontology (GO)	Gene Ontology IDs
4CLLA_ARATH	Q9SMT7	4CLLA_ARATH	Oxalate--CoA ligase (EC 6.2.1.8) (4-coumarate--CoA ligase isoform 8) (At4CL8) (4-coumarate--CoA ligase-like 10) (Acyl-activating enzyme 3) (Adenosine monophosphate binding protein 3) (AtMPBP3) (Oxalyl-CoA synthetase)	AAE3 4CLL10 AMPBP3 At3g48990 T2J13.170	Arabidopsis thaliana (Mouse-ear cress)	514	FUNCTION: Oxalyl-CoA synthetase acting exclusively against oxalate (PubMed:22447686, PubMed:27326693). Follows a two-step reaction mechanism, wherein oxalate first undergoes adenylation by ATP, followed by a thioesterification in the presence of CoA to yield oxalyl-CoA (By similarity). No activity with malonate, succinate, malate, acetate, formate, lactate, glycolate, glyoxylate or glutarate (PubMed:22447686). Required for oxalate degradation, normal seed development and defense against oxalate-producing fungal pathogens (PubMed:22447686). {ECO:0000250|UniProtKB:O24146, ECO:0000269|PubMed:22447686, ECO:0000269|PubMed:27326693}.				apoplast [GO:0048046]; chloroplast [GO:0009507]; chloroplast stroma [GO:0009570]; cytoplasm [GO:0005737]; cytosol [GO:0005829]; plasmodesma [GO:0009506]; ATP binding [GO:0005524]; medium-chain fatty acid-CoA ligase activity [GO:0031956]; oxalate-CoA ligase activity [GO:0050203]; defense response to fungus [GO:0050832]; fatty acid metabolic process [GO:0006631]; oxalate catabolic process [GO:0033611]; positive regulation of seed germination [GO:0010030]; seed coat development [GO:0010214]	GO:0005524; GO:0005737; GO:0005829; GO:0006631; GO:0009506; GO:0009507; GO:0009570; GO:0010030; GO:0010214; GO:0031956; GO:0033611; GO:0048046; GO:0050203; GO:0050832
NLP2_ORYSJ	Q0JC27	NLP2_ORYSJ	Protein NLP2 (OsNLP2) (NIN-like protein 2) (Nodule inception protein-like protein 2)	NLP2 Os04g0495800 LOC_Os04g41850 J033120P08 OsJ_15319 OSJNBa0067K08.5	Oryza sativa subsp. japonica (Rice)	936	FUNCTION: Probable transcription factor. {ECO:0000250}.				nucleus [GO:0005634]; DNA binding [GO:0003677]; DNA-binding transcription factor activity [GO:0003700]	GO:0003677; GO:0003700; GO:0005634
RGLG3_ARATH	Q8RX26	RGLG3_ARATH	E3 ubiquitin-protein ligase RGLG3 (EC 2.3.2.27) (RING domain ligase 3)	RGLG3 At5g63970	Arabidopsis thaliana (Mouse-ear cress)	367	FUNCTION: Possesses E3 ubiquitin-protein ligase in vitro. Acts as upstream modulator of jasmonate (JA) signaling in response to various stimuli, such as JA-inhibited root growth, JA-inductive gene expression, coronatine-mediated pathogen susceptibility, wound-stimulated expression of JA-responsive genes and wound-induced JA biosynthesis (PubMed:22898498). Controls fumonisin B1 (FB1)-triggered programmed cell death (PCD) by modulating the JA signaling pathway. May mediate salicylic acid (SA) suppression of JA signaling in FB1-induced responses (PubMed:25788731). May mediate the formation of 'Lys-48'-linked multiubiquitin chains. Mediates the polyubiquitination and subsequent proteasomal degradation of the target protein GRXS17 (PubMed:27497447). {ECO:0000269|PubMed:22898498, ECO:0000269|PubMed:25788731, ECO:0000269|PubMed:27497447}.			TISSUE SPECIFICITY: Widely expressed. {ECO:0000269|PubMed:22898498}.	cytoplasm [GO:0005737]; nucleus [GO:0005634]; metal ion binding [GO:0046872]; ubiquitin-protein transferase activity [GO:0004842]; defense response to bacterium [GO:0042742]; jasmonic acid mediated signaling pathway [GO:0009867]; response to wounding [GO:0009611]	GO:0004842; GO:0005634; GO:0005737; GO:0009611; GO:0009867; GO:0042742; GO:0046872
EIN3_ARATH	O24606	EIN3_ARATH	Protein ETHYLENE INSENSITIVE 3	EIN3 At3g20770 MOE17.8	Arabidopsis thaliana (Mouse-ear cress)	628	FUNCTION: Transcription factor acting as a positive regulator in the ethylene response pathway, by promoting histone acetylation in an ENAP1-dependent manner, thus accelerating the expression of ethylene-responsive genes (PubMed:28874528). Binds DNA (PubMed:26352699). Is required for ethylene responsiveness in adult plant tissues. Binds a primary ethylene response element present in the ETHYLENE-RESPONSE-FACTOR1 promoter with consequence to activate the transcription of this gene. {ECO:0000269|PubMed:26352699, ECO:0000269|PubMed:28874528, ECO:0000269|PubMed:9215635, ECO:0000269|PubMed:9851977}.				nucleus [GO:0005634]; chromatin binding [GO:0003682]; DNA binding [GO:0003677]; DNA-binding transcription factor activity [GO:0003700]; histone binding [GO:0042393]; kinase binding [GO:0019900]; transcription cis-regulatory region binding [GO:0000976]; defense response to bacterium [GO:0042742]; epigenetic regulation of gene expression [GO:0040029]; ethylene-activated signaling pathway [GO:0009873]; regulation of DNA-templated transcription [GO:0006355]; regulation of L-ascorbic acid biosynthetic process [GO:2000082]; response to ethylene [GO:0009723]; response to hypoxia [GO:0001666]; sugar mediated signaling pathway [GO:0010182]	GO:0000976; GO:0001666; GO:0003677; GO:0003682; GO:0003700; GO:0005634; GO:0006355; GO:0009723; GO:0009873; GO:0010182; GO:0019900; GO:0040029; GO:0042393; GO:0042742; GO:2000082
KSG8_ARATH	Q96287	KSG8_ARATH	Shaggy-related protein kinase theta (EC 2.7.11.1) (ASK-theta) (Shaggy-related protein kinase 32) (AtSK32)	ASK8 SK32 At4g00720 F6N23.11	Arabidopsis thaliana (Mouse-ear cress)	472	FUNCTION: May mediate extracellular signals to regulate transcription in differentiating cells. {ECO:0000250}.				cytoplasm [GO:0005737]; nucleus [GO:0005634]; ATP binding [GO:0005524]; kinase activity [GO:0016301]; protein serine kinase activity [GO:0106310]; protein serine/threonine kinase activity [GO:0004674]; protein autophosphorylation [GO:0046777]; response to brassinosteroid [GO:0009741]; signal transduction [GO:0007165]	GO:0004674; GO:0005524; GO:0005634; GO:0005737; GO:0007165; GO:0009741; GO:0016301; GO:0046777; GO:0106310
FAD2_VERFO	Q8GZC3	FAD2_VERFO	Delta(12)-fatty-acid desaturase FAD2 (EC 1.14.19.6)	FAD2	Vernicia fordii (Tung) (Aleurites fordii)	383	FUNCTION: Catalyzes the desaturation of oleic acid (18:1(9Z)) to linoleic acid (18:2(9Z,12Z)). {ECO:0000269|PubMed:12481086}.	PATHWAY: Lipid metabolism; polyunsaturated fatty acid biosynthesis.		TISSUE SPECIFICITY: Expressed in leaves and seeds. {ECO:0000269|PubMed:12481086}.	endoplasmic reticulum membrane [GO:0005789]; delta12-fatty-acid desaturase activity [GO:0102985]; palmitoleic acid delta 12 desaturase activity [GO:0102987]; unsaturated fatty acid biosynthetic process [GO:0006636]	GO:0005789; GO:0006636; GO:0102985; GO:0102987
CCX1_ARATH	Q9FKP1	CCX1_ARATH	Cation/calcium exchanger 1 (AtCCX1) (Protein CATION EXCHANGER 7)	CCX1 CAX7 At5g17860 MPI7.2 MVA3_210	Arabidopsis thaliana (Mouse-ear cress)	570	FUNCTION: Vacuolar membrane-localized H(+)-dependent K(+) and Na(+) transporter. {ECO:0000269|Ref.5, ECO:0000269|Ref.6}.			TISSUE SPECIFICITY: Expressed in roots, leaves, stems and flowers. {ECO:0000269|Ref.6}.	membrane [GO:0016020]; vacuolar membrane [GO:0005774]; antiporter activity [GO:0015297]; monoatomic cation transmembrane transporter activity [GO:0008324]; monoatomic cation transport [GO:0006812]; potassium ion transport [GO:0006813]; sodium ion transport [GO:0006814]	GO:0005774; GO:0006812; GO:0006813; GO:0006814; GO:0008324; GO:0015297; GO:0016020
PME21_ARATH	Q8GX86	PME21_ARATH	Probable pectinesterase/pectinesterase inhibitor 21 [Includes: Pectinesterase inhibitor 21 (Pectin methylesterase inhibitor 21); Pectinesterase 21 (PE 21) (EC 3.1.1.11) (Pectin methylesterase 21) (AtPME21)]	PME21 ARATH21 At3g05610 F18C1.12	Arabidopsis thaliana (Mouse-ear cress)	669	FUNCTION: Acts in the modification of cell walls via demethylesterification of cell wall pectin. {ECO:0000250}.	PATHWAY: Glycan metabolism; pectin degradation; 2-dehydro-3-deoxy-D-gluconate from pectin: step 1/5.		TISSUE SPECIFICITY: Expressed in flower buds. {ECO:0000269|PubMed:16622707}.	membrane [GO:0016020]; aspartyl esterase activity [GO:0045330]; pectinesterase activity [GO:0030599]; pectinesterase inhibitor activity [GO:0046910]; cell wall modification [GO:0042545]; pectin catabolic process [GO:0045490]	GO:0016020; GO:0030599; GO:0042545; GO:0045330; GO:0045490; GO:0046910
PME58_ARATH	Q9FJ21	PME58_ARATH	Probable pectinesterase/pectinesterase inhibitor 58 [Includes: Pectinesterase inhibitor 58 (Pectin methylesterase inhibitor 58); Pectinesterase 58 (PE 58) (EC 3.1.1.11) (Pectin methylesterase 58) (AtPME58)]	PME58 ARATH58 At5g49180 K21P3.5	Arabidopsis thaliana (Mouse-ear cress)	571	FUNCTION: Acts in the modification of cell walls via demethylesterification of cell wall pectin. {ECO:0000250}.	PATHWAY: Glycan metabolism; pectin degradation; 2-dehydro-3-deoxy-D-gluconate from pectin: step 1/5.	DEVELOPMENTAL STAGE: Expression restricted to early to mid-stage of silique development. Not found in vegetative stage. Expressed in the micropyle area of the ovule just after fertilization. {ECO:0000269|PubMed:16622707}.	TISSUE SPECIFICITY: Expressed in siliques, but not in flower buds. {ECO:0000269|PubMed:16622707}.	extracellular region [GO:0005576]; aspartyl esterase activity [GO:0045330]; pectinesterase activity [GO:0030599]; pectinesterase inhibitor activity [GO:0046910]; cell wall modification [GO:0042545]; mucilage metabolic process involved in seed coat development [GO:0048359]; mucilage pectin biosynthetic process [GO:0048358]; pectin catabolic process [GO:0045490]	GO:0005576; GO:0030599; GO:0042545; GO:0045330; GO:0045490; GO:0046910; GO:0048358; GO:0048359
MBR2_ARATH	O49500	MBR2_ARATH	E3 ubiquitin-protein ligase MBR2 (EC 2.3.2.27) (HAL3-interacting protein 1 homolog) (AtHIP1) (MED25-binding RING-H2 protein 2) (RING-H2 finger MBR2) (RING-type E3 ubiquitin transferase MBR2)	MBR2 HIP1 At4g34040	Arabidopsis thaliana (Mouse-ear cress)	666	FUNCTION: E3 ubiquitin-protein ligase that functions as regulator of MED25 stability by targeting MED25 for degradation in a RING-H2-dependent way. Proteasome-dependent degradation of MED25 seems to activate its function as positive regulator of FLOWERING LOCUS T (FT) and is important to induce the expression of FT and consequently to promote flowering. May function downstream of HAL3 and be required for HAL3-regulated plant growth. Activation of MBR2 by HAL3 may lead to the degradation of cell cycle suppressors, resulting in enhancement of cell division and plant growth. {ECO:0000269|PubMed:19543273, ECO:0000269|PubMed:22992513}.	PATHWAY: Protein modification; protein ubiquitination.			metal ion binding [GO:0046872]; ubiquitin protein ligase activity [GO:0061630]; flower development [GO:0009908]; proteasome-mediated ubiquitin-dependent protein catabolic process [GO:0043161]; protein ubiquitination [GO:0016567]; vegetative to reproductive phase transition of meristem [GO:0010228]	GO:0009908; GO:0010228; GO:0016567; GO:0043161; GO:0046872; GO:0061630
RHG1A_ARATH	Q9FMM4	RHG1A_ARATH	Probable E3 ubiquitin-protein ligase RHG1A (EC 2.3.2.27) (RING-H2 finger G1a) (RING-H2 zinc finger protein RHG1a) (RING-type E3 ubiquitin transferase RHG1A)	RHG1A At5g42940 MBD2.14	Arabidopsis thaliana (Mouse-ear cress)	691	FUNCTION: Probable E3 ubiquitin-protein ligase that may possess E3 ubiquitin ligase activity in vitro. {ECO:0000250|UniProtKB:Q9ZT50}.	PATHWAY: Protein modification; protein ubiquitination. {ECO:0000305}.		TISSUE SPECIFICITY: Expressed in stems, flowers, green siliques, cauline leaves, seeds and roots. {ECO:0000269|PubMed:9781696}.	metal ion binding [GO:0046872]; ubiquitin protein ligase activity [GO:0061630]; protein ubiquitination [GO:0016567]	GO:0016567; GO:0046872; GO:0061630
NYC1_ARATH	Q93ZA0	NYC1_ARATH	Probable chlorophyll(ide) b reductase NYC1, chloroplastic (EC 1.1.1.294) (Protein NON-YELLOW COLORING 1) (AtNYC1)	NYC1 At4g13250 F17N18.140	Arabidopsis thaliana (Mouse-ear cress)	496	FUNCTION: Involved in chlorophyll b degradation. Belongs to the chlorophyll catabolic enzymes (CCEs). {ECO:0000269|PubMed:19403948}.		DEVELOPMENTAL STAGE: Up-regulated during senescence. {ECO:0000269|PubMed:23200839}.		chloroplast [GO:0009507]; chloroplast thylakoid membrane [GO:0009535]; chlorophyll(ide) b reductase activity [GO:0034256]; chlorophyll catabolic process [GO:0015996]; PSII associated light-harvesting complex II catabolic process [GO:0010304]	GO:0009507; GO:0009535; GO:0010304; GO:0015996; GO:0034256
MGDG2_ARATH	O82730	MGDG2_ARATH	Monogalactosyldiacylglycerol synthase 2, chloroplastic (AtMGD2) (EC 2.4.1.46) (MGDG synthase type B)	MGD2 MGDB At5g20410 F5O24.300 F7C8	Arabidopsis thaliana (Mouse-ear cress)	468	FUNCTION: Involved in the synthesis of monogalactosyldiacylglycerol, the major structural component of photosynthetic membranes and in the chloroplast envelope biogenesis. Can use both prokaryotic (18:1/16:0) or eukaryotic (18:2/18:2) 1,2-diacylglycerol species, but operates with some preference for the eukaryotic one. Plays a minor role in galactolipid synthesis in chloroplasts (PubMed:11553816). Is required for membrane lipid remodeling in phosphate-starved roots (PubMed:18808455, PubMed:31201686). Acts as the minor factor involved in digalactosyldiacylglycerol (DGDG) biosynthesis in phosphate-starved roots (PubMed:18808455). Does not seem to be required for plant growth under nutrient-sufficient conditions (PubMed:18808455). Required for membrane lipid remodeling in plants grown in acidic conditions (PubMed:31201686). {ECO:0000269|PubMed:11553816, ECO:0000269|PubMed:18808455, ECO:0000269|PubMed:31201686}.		DEVELOPMENTAL STAGE: Low and continuous expression throughout whole developmental stages. {ECO:0000269|PubMed:11553816}.	TISSUE SPECIFICITY: Expressed mainly in floral buds. Detected in roots, leaves, stems, siliques and pollen tubes. {ECO:0000269|PubMed:11553816, ECO:0000269|PubMed:14730084}.	chloroplast outer membrane [GO:0009707]; 1,2-diacylglycerol 3-beta-galactosyltransferase activity [GO:0046509]; UDP-galactosyltransferase activity [GO:0035250]; cellular response to phosphate starvation [GO:0016036]; fatty acid metabolic process [GO:0006631]; galactolipid metabolic process [GO:0019374]; glycolipid biosynthetic process [GO:0009247]	GO:0006631; GO:0009247; GO:0009707; GO:0016036; GO:0019374; GO:0035250; GO:0046509
C70B1_ARATH	Q9C788	C70B1_ARATH	Cytochrome P450 704B1 (Long-chain fatty acid omega-hydroxylase) (EC 1.14.14.80)	CYP704B1 At1g69500 F10D13.15	Arabidopsis thaliana (Mouse-ear cress)	524	FUNCTION: Involved in pollen wall development. Catalyzes the conversion of long-chain fatty acids to the corresponding omega-hydroxylated fatty acids. Omega-hydroxylated fatty acids, together with in-chain hydroxylated fatty acids, are key monomeric aliphatic building blocks for sporopollenin synthesis during exine formation. {ECO:0000269|PubMed:19700560}.		DEVELOPMENTAL STAGE: Specifically expressed in anthers from early stage 9 to early stage 12 of flower development, with a peak during stages 9 to 11. {ECO:0000269|PubMed:19700560}.		membrane [GO:0016020]; alkane 1-monooxygenase activity [GO:0018685]; heme binding [GO:0020037]; iron ion binding [GO:0005506]; long-chain fatty acid omega-hydroxylase activity [GO:0102033]; pollen exine formation [GO:0010584]; sporopollenin biosynthetic process [GO:0080110]	GO:0005506; GO:0010584; GO:0016020; GO:0018685; GO:0020037; GO:0080110; GO:0102033
M240_ARATH	P93290	M240_ARATH	Uncharacterized mitochondrial protein AtMg00240 (ORF111a)	AtMg00240; At2g07729	Arabidopsis thaliana (Mouse-ear cress)	111					mitochondrion [GO:0005739]	GO:0005739
POLR1_ARATH	Q94HW2	POLR1_ARATH	Retrovirus-related Pol polyprotein from transposon RE1 (Retro element 1) (AtRE1) [Includes: Protease RE1 (EC 3.4.23.-); Reverse transcriptase RE1 (EC 2.7.7.49); Endonuclease RE1]	RE1 RF12 RF28 At1g58889 R18I; RE1 At1g59265 T4M14.18	Arabidopsis thaliana (Mouse-ear cress)	1466					aspartic-type endopeptidase activity [GO:0004190]; endonuclease activity [GO:0004519]; metal ion binding [GO:0046872]; nucleic acid binding [GO:0003676]; RNA-directed DNA polymerase activity [GO:0003964]; DNA integration [GO:0015074]; DNA recombination [GO:0006310]; proteolysis [GO:0006508]	GO:0003676; GO:0003964; GO:0004190; GO:0004519; GO:0006310; GO:0006508; GO:0015074; GO:0046872
FAH1_ARATH	O48916	FAH1_ARATH	Dihydroceramide fatty acyl 2-hydroxylase FAH1 (EC 1.14.18.7) (Fatty acid 2-hydroxylase 1) (AtFAH1)	FAH1 At2g34770 T29F13.2	Arabidopsis thaliana (Mouse-ear cress)	237	FUNCTION: Fatty acid 2-hydroxylase involved in the alpha-hydroxylation of sphingolipid-associated very long-chain fatty acids (VLCFA). Probably involved in the resistance response to oxidative stress. {ECO:0000269|PubMed:22635113, ECO:0000269|PubMed:9353282}.			TISSUE SPECIFICITY: Expressed in leaves, roots, flowers and seeds. {ECO:0000269|PubMed:22918503}.	endoplasmic reticulum [GO:0005783]; endoplasmic reticulum membrane [GO:0005789]; fatty acid alpha-hydroxylase activity [GO:0080132]; iron ion binding [GO:0005506]; sphingolipid very long chain fatty acid alpha-hydroxylase activity [GO:0102771]; fatty acid biosynthetic process [GO:0006633]; fatty acid metabolic process [GO:0006631]; very long-chain fatty acid metabolic process [GO:0000038]	GO:0000038; GO:0005506; GO:0005783; GO:0005789; GO:0006631; GO:0006633; GO:0080132; GO:0102771
AO2A_TOBAC	A0A1S3YEG8	AO2A_TOBAC	L-aspartate oxidase 2-a, chloroplastic (EC 1.4.3.16)	AO-2A LOC107775324	Nicotiana tabacum (Common tobacco)	644	FUNCTION: Involved in the biosynthesis of pyridine alkaloid natural products, leading mainly to the production of anabasine, anatabine, nicotine and nornicotine, effective deterrents against herbivores with antiparasitic and pesticide properties (neurotoxins); nornicotine serves as the precursor in the synthesis of the carcinogen compound N'-nitrosonornicotine (NNN) (PubMed:32242247). Catalyzes the oxidation of L-aspartate to iminoaspartate (By similarity). {ECO:0000250|UniProtKB:Q94AY1, ECO:0000269|PubMed:32242247}.	PATHWAY: Alkaloid biosynthesis; nicotine biosynthesis. {ECO:0000269|PubMed:32242247}.; PATHWAY: Cofactor biosynthesis; NAD(+) biosynthesis; iminoaspartate from L-aspartate (oxidase route): step 1/1. {ECO:0000250|UniProtKB:Q94AY1}.			chloroplast [GO:0009507]; L-aspartate oxidase activity [GO:0008734]; L-aspartate:fumarate oxidoreductase activity [GO:0044318]; alkaloid metabolic process [GO:0009820]; NAD biosynthetic process [GO:0009435]; nicotine biosynthetic process [GO:0042179]	GO:0008734; GO:0009435; GO:0009507; GO:0009820; GO:0042179; GO:0044318
GMK2_ARATH	Q9M682	GMK2_ARATH	Guanylate kinase 2 (AtGK2) (EC 2.7.4.8) (GMP kinase 2)	GK-2 AGK2 At3g57550 T8H10.150	Arabidopsis thaliana (Mouse-ear cress)	389	FUNCTION: Essential for recycling GMP and indirectly, cGMP. Required for normal development of the gametophyte and embryo, in association with GK1. {ECO:0000269|PubMed:17727616}.				cytosol [GO:0005829]; ATP binding [GO:0005524]; guanylate kinase activity [GO:0004385]; gametophyte development [GO:0048229]; phosphorylation [GO:0016310]; regulation of developmental growth [GO:0048638]	GO:0004385; GO:0005524; GO:0005829; GO:0016310; GO:0048229; GO:0048638
4CLL3_ORYSJ	Q6YYZ2	4CLL3_ORYSJ	4-coumarate--CoA ligase-like 3 (EC 6.2.1.12)	4CLL3 Os08g0143300 LOC_Os08g04770 P0025F03.16 P0473D02.38	Oryza sativa subsp. japonica (Rice)	591	FUNCTION: Carboxylate--CoA ligase that may use 4-coumarate as substrate. Follows a two-step reaction mechanism, wherein the carboxylate substrate first undergoes adenylation by ATP, followed by a thioesterification in the presence of CoA to yield the final CoA thioester. {ECO:0000250|UniProtKB:O24146}.				peroxisome [GO:0005777]; 4-coumarate-CoA ligase activity [GO:0016207]; ATP binding [GO:0005524]; CoA-ligase activity [GO:0016405]; trans-cinnamate-CoA ligase activity [GO:0106290]; phenylpropanoid metabolic process [GO:0009698]; ubiquinone biosynthetic process [GO:0006744]	GO:0005524; GO:0005777; GO:0006744; GO:0009698; GO:0016207; GO:0016405; GO:0106290
4CLL6_ARATH	Q84P24	4CLL6_ARATH	4-coumarate--CoA ligase-like 6 (EC 6.2.1.-) (4-coumarate--CoA ligase) (EC 6.2.1.12) (4-coumarate--CoA ligase isoform 7) (At4CL7) (4-hydroxybenzoate--CoA ligase) (EC 6.2.1.27)	4CLL6 At4g19010 F13C5.180	Arabidopsis thaliana (Mouse-ear cress)	566	FUNCTION: Contributes to jasmonic acid biosynthesis by initiating the beta-oxidative chain shortening of its precursors (PubMed:18267944). Acts as a carboxylate--CoA ligase that can use preferentially p-coumarate, ferulate and caffeate as substrates and, with a lower efficiency, (E)-cinnamate and 4-hydroxybenzoate as substrates (PubMed:24838974). Involved in the biosynthesis of ubiquinone from phenylalanine by activating the propyl side chain of 4-coumarate, and possibly trans-cinnamate and 4-hydroxybenzoate, for subsequent beta-oxidative shortening and the formation of the benzenoid moiety of ubiquinone (PubMed:24838974). Follows a two-step reaction mechanism, wherein the carboxylate substrate first undergoes adenylation by ATP, followed by a thioesterification in the presence of CoA to yield the final CoA thioester (By similarity). {ECO:0000250|UniProtKB:O24146, ECO:0000269|PubMed:18267944, ECO:0000269|PubMed:24838974}.			TISSUE SPECIFICITY: Expressed at very low level in leaves. {ECO:0000269|PubMed:18267944}.	peroxisome [GO:0005777]; (E)-caffeate-CoA ligase activity [GO:0106286]; 4-coumarate-CoA ligase activity [GO:0016207]; 4-hydroxybenzoate-CoA ligase activity [GO:0018859]; ATP binding [GO:0005524]; CoA-ligase activity [GO:0016405]; trans-cinnamate-CoA ligase activity [GO:0106290]; ubiquinone biosynthetic process [GO:0006744]	GO:0005524; GO:0005777; GO:0006744; GO:0016207; GO:0016405; GO:0018859; GO:0106286; GO:0106290
SPS2_ARATH	Q76FS5	SPS2_ARATH	Solanesyl diphosphate synthase 2, chloroplastic (AtSPS2) (EC 2.5.1.85) (All-trans-nonaprenyl-diphosphate synthase 2 (geranylgeranyl-diphosphate specific))	SPS2 SPPS At1g17050 F20D23.25	Arabidopsis thaliana (Mouse-ear cress)	417	FUNCTION: Involved in providing solanesyl diphosphate for plastoquinone-9 (PQ-9) formation in plastids (PubMed:15784989, PubMed:23913686) (Probable). Catalyzes the elongation of the prenyl side chain of PQ-9 in plastids (PubMed:23913686). Contributes to the biosynthesis of plastochromanol-8 (PC-8) in plastids (PubMed:23913686). Does not contribute to the synthesis of tocopherol or ubiquinone (PubMed:23913686). PQ-9 and PC-8 are lipophilic antioxidants that act as protectant against photooxidative stress under high light stress conditions (PubMed:23913686). Prefers geranylgeranyl diphosphate to farnesyl diphosphate as substrate (PubMed:15784989). No activity with geranyl diphosphate or dimethylallyl diphosphate as substrate (PubMed:15784989). {ECO:0000269|PubMed:15784989, ECO:0000269|PubMed:23913686, ECO:0000305|PubMed:15653808}.			TISSUE SPECIFICITY: Higher expression in leaves than in roots. {ECO:0000269|PubMed:15784989}.	chloroplast [GO:0009507]; chloroplast stroma [GO:0009570]; plastid [GO:0009536]; all-trans-nonaprenyl-diphosphate synthase (geranylgeranyl-diphosphate specific) activity [GO:0052924]; metal ion binding [GO:0046872]; prenyltransferase activity [GO:0004659]; isoprenoid biosynthetic process [GO:0008299]; plastoquinone biosynthetic process [GO:0010236]	GO:0004659; GO:0008299; GO:0009507; GO:0009536; GO:0009570; GO:0010236; GO:0046872; GO:0052924
ERG16_ARATH	Q8VYH2	ERG16_ARATH	Squalene epoxidase 3 (AtSQE3) (EC 1.14.14.17)	SQE3 At4g37760 T28I19.4	Arabidopsis thaliana (Mouse-ear cress)	525	FUNCTION: Catalyzes the stereospecific oxidation of squalene to (S)-2,3-epoxysqualene, and is considered to be a rate-limiting enzyme in steroid biosynthesis. Can produce not only oxidosqualene, but also 2,3:22,23-dioxidosqualene. {ECO:0000269|PubMed:17426032}.	PATHWAY: Terpene metabolism; lanosterol biosynthesis; lanosterol from farnesyl diphosphate: step 2/3.		TISSUE SPECIFICITY: Expressed in seedlings, leaves, stems, inflorescences and siliques. {ECO:0000269|PubMed:17426032}.	endoplasmic reticulum [GO:0005783]; membrane [GO:0016020]; flavin adenine dinucleotide binding [GO:0050660]; squalene monooxygenase activity [GO:0004506]; response to jasmonic acid [GO:0009753]; response to wounding [GO:0009611]; sterol biosynthetic process [GO:0016126]	GO:0004506; GO:0005783; GO:0009611; GO:0009753; GO:0016020; GO:0016126; GO:0050660
