From	Entry	Entry Name	Protein names	Gene Names	Organism	Length	Function [CC]	Pathway	Developmental stage	Tissue specificity	Gene Ontology (GO)	Gene Ontology IDs
MIZ1_ARATH	O22227	MIZ1_ARATH	Protein MIZU-KUSSEI 1	MIZ1 At2g41660 T32G6.18	Arabidopsis thaliana (Mouse-ear cress)	297	FUNCTION: Plays a role in lateral root development by maintaining auxin levels. This function requires GNOM (GN/MIZ2) activity. Negatively regulates cytokinin sensitivity on root development. Positively regulates hydrotropism in roots. {ECO:0000269|PubMed:17360591, ECO:0000269|PubMed:21940997, ECO:0000269|PubMed:22285304, ECO:0000269|PubMed:22321255, ECO:0000269|PubMed:23012350}.			TISSUE SPECIFICITY: Expressed in root meristematic region, cortical cells, lateral root cap cells, columella cells of the root cap, mature region of the roots and leaf hydathodes. {ECO:0000269|PubMed:17360591, ECO:0000269|PubMed:22285304}.	cortical endoplasmic reticulum [GO:0032541]; cytoplasm [GO:0005737]; endoplasmic reticulum [GO:0005783]; endoplasmic reticulum membrane [GO:0005789]; membrane [GO:0016020]; chloroplast organization [GO:0009658]; hydrotropism [GO:0010274]	GO:0005737; GO:0005783; GO:0005789; GO:0009658; GO:0010274; GO:0016020; GO:0032541
FRA14_FRAAN	A0A024B3D0	FRA14_FRAAN	Major strawberry allergen Fra a 1.04 (Class 10 plant pathogenesis-related protein Fra a 1.04) (PR10-related protein Fra a 1.04) (EC 3.1.27.-) (allergen Fra a 1)	Fra a 1.04	Fragaria ananassa (Strawberry) (Fragaria chiloensis x Fragaria virginiana)	160	FUNCTION: Possesses ribonuclease activity in vitro. {ECO:0000269|PubMed:30572279}.			TISSUE SPECIFICITY: Highly expressed in roots (PubMed:30572279). Expressed a low levels in ripe red fruits (PubMed:30572279). {ECO:0000269|PubMed:30572279}.	abscisic acid binding [GO:0010427]; nuclease activity [GO:0004518]; protein phosphatase inhibitor activity [GO:0004864]; signaling receptor activity [GO:0038023]; abscisic acid-activated signaling pathway [GO:0009738]; defense response [GO:0006952]; response to biotic stimulus [GO:0009607]	GO:0004518; GO:0004864; GO:0006952; GO:0009607; GO:0009738; GO:0010427; GO:0038023
PRU1_PRUAR	O50001	PRU1_PRUAR	Major allergen Pru ar 1 (allergen Pru ar 1)		Prunus armeniaca (Apricot) (Armeniaca vulgaris)	160					abscisic acid binding [GO:0010427]; protein phosphatase inhibitor activity [GO:0004864]; signaling receptor activity [GO:0038023]; abscisic acid-activated signaling pathway [GO:0009738]; defense response [GO:0006952]; response to biotic stimulus [GO:0009607]	GO:0004864; GO:0006952; GO:0009607; GO:0009738; GO:0010427; GO:0038023
AVT6C_ARATH	Q9LYM2	AVT6C_ARATH	Amino acid transporter AVT6C (AtAvt6C)	AVT6C At3g56200 F18O21_160	Arabidopsis thaliana (Mouse-ear cress)	435					membrane [GO:0016020]; L-amino acid transmembrane transporter activity [GO:0015179]; amino acid transmembrane transport [GO:0003333]	GO:0003333; GO:0015179; GO:0016020
CAF1K_ARATH	Q9FMS6	CAF1K_ARATH	Probable CCR4-associated factor 1 homolog 11 (EC 3.1.13.4)	CAF1-11 At5g22250 T6G21.2	Arabidopsis thaliana (Mouse-ear cress)	278	FUNCTION: Ubiquitous transcription factor required for a diverse set of processes. It is a component of the CCR4 complex involved in the control of gene expression (By similarity). {ECO:0000250}.				CCR4-NOT core complex [GO:0030015]; nucleus [GO:0005634]; P-body [GO:0000932]; 3'-5' exonuclease activity [GO:0008408]; metal ion binding [GO:0046872]; poly(A)-specific ribonuclease activity [GO:0004535]; RNA binding [GO:0003723]; defense response to bacterium [GO:0042742]; exonucleolytic catabolism of deadenylated mRNA [GO:0043928]; nuclear-transcribed mRNA poly(A) tail shortening [GO:0000289]	GO:0000289; GO:0000932; GO:0003723; GO:0004535; GO:0005634; GO:0008408; GO:0030015; GO:0042742; GO:0043928; GO:0046872
ALL8_OLEEU	Q9M7R0	ALL8_OLEEU	Calcium-binding allergen Ole e 8 (PCA18/PCA23) (allergen Ole e 8)		Olea europaea (Common olive)	171				TISSUE SPECIFICITY: Expressed in pollen. {ECO:0000269|PubMed:10648840}.	calcium ion binding [GO:0005509]	GO:0005509
MD26B_ARATH	Q9FHK9	MD26B_ARATH	Probable mediator of RNA polymerase II transcription subunit 26b	MED26B MED26_2 At5g05140 K2A11.1	Arabidopsis thaliana (Mouse-ear cress)	436	FUNCTION: Component of the Mediator complex, a coactivator involved in the regulated transcription of nearly all RNA polymerase II-dependent genes. Mediator functions as a bridge to convey information from gene-specific regulatory proteins to the basal RNA polymerase II transcription machinery. The Mediator complex, having a compact conformation in its free form, is recruited to promoters by direct interactions with regulatory proteins and serves for the assembly of a functional preinitiation complex with RNA polymerase II and the general transcription factors (By similarity). May play a role in transcription elongation (By similarity). {ECO:0000250}.				nucleus [GO:0005634]; translation elongation factor activity [GO:0003746]	GO:0003746; GO:0005634
KTN81_ARATH	A0A1P8AW69	KTN81_ARATH	Katanin p80 WD40 repeat-containing subunit B1 homolog KTN80.1	KTN80.1 At1g11160 T28P6.17	Arabidopsis thaliana (Mouse-ear cress)	1019	FUNCTION: May participate in a complex which severs microtubules in an ATP-dependent manner (By similarity). Microtubule severing may promote rapid reorganization of cellular microtubule arrays (By similarity). Confers precision to microtubule (MT) severing by specific targeting of KTN1 to MT cleavage sites such as crossover or branching nucleation sites (PubMed:28978669). Together with other KTN80s, regulates cell elongation by modulating MT organization (PubMed:28978669). {ECO:0000255|HAMAP-Rule:MF_03022, ECO:0000269|PubMed:28978669}.			TISSUE SPECIFICITY: Expressed at low levels in siliques, flowers, leaves, stems and roots. {ECO:0000269|PubMed:28978669}.	cytoplasm [GO:0005737]; katanin complex [GO:0008352]; microtubule [GO:0005874]; microtubule cytoskeleton [GO:0015630]; microtubule binding [GO:0008017]; microtubule depolymerization [GO:0007019]; microtubule severing [GO:0051013]; regulation of unidimensional cell growth [GO:0051510]	GO:0005737; GO:0005874; GO:0007019; GO:0008017; GO:0008352; GO:0015630; GO:0051013; GO:0051510
KTN82_ARATH	F4HTH8	KTN82_ARATH	Katanin p80 WD40 repeat-containing subunit B1 homolog KTN80.2 (DDB1 binding WD40 hypersensitive to ABA 3) (DWD hypersensitive to ABA 3)	KTN80.2 DWA3 At1g61210 F11P17.7	Arabidopsis thaliana (Mouse-ear cress)	1181	FUNCTION: May participate in a complex which severs microtubules in an ATP-dependent manner (By similarity). Microtubule severing may promote rapid reorganization of cellular microtubule arrays (By similarity). Confers precision to microtubule (MT) severing by specific targeting of KTN1 to MT cleavage sites such as crossover or branching nucleation sites (PubMed:28978669). Together with other KTN80s, regulates cell elongation by modulating MT organization (PubMed:28978669). Negative regulator of abscisic acid (ABA) responses (PubMed:21421380). May function as a substrate receptor for cullin-RING ubiquitin ligase 4 complexes (CRL4), a family of E3 ligases involved in protein degradation (PubMed:21421380). {ECO:0000255|HAMAP-Rule:MF_03022, ECO:0000269|PubMed:21421380, ECO:0000269|PubMed:28978669}.			TISSUE SPECIFICITY: Expressed at low levels in siliques, flowers, leaves, stems and roots. {ECO:0000269|PubMed:28978669}.	Cul4-RING E3 ubiquitin ligase complex [GO:0080008]; cytoplasm [GO:0005737]; katanin complex [GO:0008352]; microtubule [GO:0005874]; microtubule cytoskeleton [GO:0015630]; microtubule binding [GO:0008017]; microtubule depolymerization [GO:0007019]; microtubule severing [GO:0051013]; regulation of unidimensional cell growth [GO:0051510]; response to abscisic acid [GO:0009737]; response to salt stress [GO:0009651]	GO:0005737; GO:0005874; GO:0007019; GO:0008017; GO:0008352; GO:0009651; GO:0009737; GO:0015630; GO:0051013; GO:0051510; GO:0080008
PSS1_ARATH	F4HXY7	PSS1_ARATH	CDP-diacylglycerol--serine O-phosphatidyltransferase 1 (EC 2.7.8.8) (Phosphatidylserine synthase 1)	PSS1 At1g15110 F9L1.4	Arabidopsis thaliana (Mouse-ear cress)	425	FUNCTION: Catalyzes a base-exchange reaction in which the polar head group of phosphatidylethanolamine (PE) or phosphatidylcholine (PC) is replaced by L-serine. Is essential for phosphatidylserine (PS) biosynthesis and PE seems to be the most plausible substrate. Plays an important role in microspore maturation. {ECO:0000269|PubMed:21554450}.	PATHWAY: Phospholipid metabolism; phosphatidylethanolamine biosynthesis; phosphatidylethanolamine from CDP-diacylglycerol: step 1/2.	DEVELOPMENTAL STAGE: Expressed in anthers and microspores at floral stages 9 to 12, tapetum at floral stages 7 to 11, mature embryos at 5 days after flowering and dry seed embryos.	TISSUE SPECIFICITY: Expressed in trichomes, leaf veins and root vasculature. {ECO:0000269|PubMed:21554450}.	endoplasmic reticulum membrane [GO:0005789]; nuclear membrane [GO:0031965]; CDP-diacylglycerol-serine O-phosphatidyltransferase activity [GO:0003882]; L-serine-phosphatidylethanolamine phosphatidyltransferase activity [GO:0106245]; microsporogenesis [GO:0009556]; phosphatidylethanolamine biosynthetic process [GO:0006646]; phosphatidylserine biosynthetic process [GO:0006659]	GO:0003882; GO:0005789; GO:0006646; GO:0006659; GO:0009556; GO:0031965; GO:0106245
PSS1_ORYSJ	Q0JR55	PSS1_ORYSJ	CDP-diacylglycerol--serine O-phosphatidyltransferase 1 (EC 2.7.8.8) (Phosphatidylserine synthase 1)	PSS1 Os01g0118300 LOC_Os01g02890	Oryza sativa subsp. japonica (Rice)	425	FUNCTION: Catalyzes a base-exchange reaction in which the polar head group of phosphatidylethanolamine (PE) or phosphatidylcholine (PC) is replaced by L-serine. {ECO:0000250}.	PATHWAY: Phospholipid metabolism; phosphatidylethanolamine biosynthesis; phosphatidylethanolamine from CDP-diacylglycerol: step 1/2.			endoplasmic reticulum membrane [GO:0005789]; CDP-diacylglycerol-serine O-phosphatidyltransferase activity [GO:0003882]; L-serine-phosphatidylethanolamine phosphatidyltransferase activity [GO:0106245]; phosphatidylethanolamine biosynthetic process [GO:0006646]; phosphatidylserine biosynthetic process [GO:0006659]	GO:0003882; GO:0005789; GO:0006646; GO:0006659; GO:0106245
PSS2_ORYSJ	Q6I628	PSS2_ORYSJ	CDP-diacylglycerol--serine O-phosphatidyltransferase 2 (EC 2.7.8.8) (Phosphatidylserine synthase 2)	PSS2 Os05g0554400 LOC_Os05g48060 OJ1263_E10.9 OsJ_19482	Oryza sativa subsp. japonica (Rice)	423	FUNCTION: Catalyzes a base-exchange reaction in which the polar head group of phosphatidylethanolamine (PE) or phosphatidylcholine (PC) is replaced by L-serine. {ECO:0000250}.	PATHWAY: Phospholipid metabolism; phosphatidylethanolamine biosynthesis; phosphatidylethanolamine from CDP-diacylglycerol: step 1/2.			endoplasmic reticulum membrane [GO:0005789]; CDP-diacylglycerol-serine O-phosphatidyltransferase activity [GO:0003882]; L-serine-phosphatidylethanolamine phosphatidyltransferase activity [GO:0106245]; phosphatidylethanolamine biosynthetic process [GO:0006646]; phosphatidylserine biosynthetic process [GO:0006659]	GO:0003882; GO:0005789; GO:0006646; GO:0006659; GO:0106245
ATG8C_SOLTU	M1C146	ATG8C_SOLTU	Autophagy-related protein 8C-like (Autophagy-related ubiquitin-like modifier ATG8CL)	ATG8CL	Solanum tuberosum (Potato)	119	FUNCTION: Ubiquitin-like modifier involved in autophagosomes formation (Probable). May mediate the delivery of the autophagosomes to the vacuole via the microtubule cytoskeleton (Probable). ATG8CL-mediated selective autophagy contributes to defense against the fungal pathogen Phytophtora infestans (PubMed:26765567, PubMed:29932422). {ECO:0000269|PubMed:26765567, ECO:0000269|PubMed:29932422, ECO:0000305|PubMed:26765567, ECO:0000305|PubMed:29932422}.				autophagosome membrane [GO:0000421]; cytoplasmic vesicle [GO:0031410]; cytoskeleton [GO:0005856]; plant-type vacuole membrane [GO:0009705]; autophagosome assembly [GO:0000045]; cellular response to nitrogen starvation [GO:0006995]; defense response to fungus [GO:0050832]	GO:0000045; GO:0000421; GO:0005856; GO:0006995; GO:0009705; GO:0031410; GO:0050832
Y5010_ARATH	Q8W485	Y5010_ARATH	Uncharacterized protein At5g50100, chloroplastic	At5g50100 MPF21.11	Arabidopsis thaliana (Mouse-ear cress)	214					chloroplast [GO:0009507]; mitochondrion [GO:0005739]; protein-disulfide reductase activity [GO:0015035]; tissue regeneration [GO:0042246]	GO:0005739; GO:0009507; GO:0015035; GO:0042246
FK201_ARATH	Q9M2S7	FK201_ARATH	Peptidyl-prolyl cis-trans isomerase FKBP20-1 (PPIase FKBP20-1) (EC 5.2.1.8) (FK506-binding protein 20-1) (AtFKBP20-1) (Immunophilin FKBP20-1) (Rotamase)	FKBP20-1 FKBP20 At3g55520 T22E16.180	Arabidopsis thaliana (Mouse-ear cress)	190	FUNCTION: PPIases accelerate the folding of proteins. It catalyzes the cis-trans isomerization of proline imidic peptide bonds in oligopeptides (By similarity). {ECO:0000250}.				cytoplasm [GO:0005737]; cytosol [GO:0005829]; peptidyl-prolyl cis-trans isomerase activity [GO:0003755]	GO:0003755; GO:0005737; GO:0005829
RK9_IPOTF	Q6JJ61	RK9_IPOTF	50S ribosomal protein L9, chloroplastic (CL9)	RPL9	Ipomoea trifida (Morning glory)	199	FUNCTION: Binds to the 23S rRNA. {ECO:0000250}.				chloroplast [GO:0009507]; ribonucleoprotein complex [GO:1990904]; ribosome [GO:0005840]; rRNA binding [GO:0019843]; structural constituent of ribosome [GO:0003735]; translation [GO:0006412]	GO:0003735; GO:0005840; GO:0006412; GO:0009507; GO:0019843; GO:1990904
GPX4_NICSY	P30708	GPX4_NICSY	Probable phospholipid hydroperoxide glutathione peroxidase (PHGPx) (EC 1.11.1.12) (6P229)		Nicotiana sylvestris (Wood tobacco) (South American tobacco)	169	FUNCTION: Protects cells and enzymes from oxidative damage, by catalyzing the reduction of hydrogen peroxide, lipid peroxides and organic hydroperoxide, by glutathione. {ECO:0000250|UniProtKB:O70325}.			TISSUE SPECIFICITY: Germinating seed, apex, flower, as well as in stressed tissues.	cytoplasm [GO:0005737]; glutathione peroxidase activity [GO:0004602]; phospholipid-hydroperoxide glutathione peroxidase activity [GO:0047066]; response to oxidative stress [GO:0006979]	GO:0004602; GO:0005737; GO:0006979; GO:0047066
SUI11_ARATH	P41568	SUI11_ARATH	Protein translation factor SUI1 homolog 1	At4g27130 F20D21.11 T24A18.80	Arabidopsis thaliana (Mouse-ear cress)	113	FUNCTION: Probably involved in translation.				cytosol [GO:0005829]; mRNA binding [GO:0003729]; RNA binding [GO:0003723]; translation initiation factor activity [GO:0003743]	GO:0003723; GO:0003729; GO:0003743; GO:0005829
TRL21_ARATH	Q8LEK4	TRL21_ARATH	Thioredoxin-like 2-1, chloroplastic (Atypical cysteine/histidine-rich thioredoxin 1) (AtACHT1)	At4g26160 F20B18.270	Arabidopsis thaliana (Mouse-ear cress)	221	FUNCTION: Thiol-disulfide oxidoreductase that may participate in various redox reactions. Possesses insulin disulfide bonds reducing activity. {ECO:0000269|PubMed:19109414}.				chloroplast [GO:0009507]; chloroplast stroma [GO:0009570]; oxidoreductase activity, acting on a sulfur group of donors, disulfide as acceptor [GO:0016671]; cell redox homeostasis [GO:0045454]; detection of redox state [GO:0051776]; regulation of photosynthesis [GO:0010109]	GO:0009507; GO:0009570; GO:0010109; GO:0016671; GO:0045454; GO:0051776
Y5986_ARATH	Q9FLE8	Y5986_ARATH	Uncharacterized protein At5g39865	At5g39865 MYH19.5	Arabidopsis thaliana (Mouse-ear cress)	390						
ISPH_ORYSJ	Q6AVG6	ISPH_ORYSJ	4-hydroxy-3-methylbut-2-enyl diphosphate reductase, chloroplastic (EC 1.17.7.4)	ISPH Os03g0731900 LOC_Os03g52170 OSJNBa0079G12.18	Oryza sativa subsp. japonica (Rice)	459	FUNCTION: Enzyme of the plastid non-mevalonate pathway for isoprenoid biosynthesis that converts 1-hydroxy-2-methyl-2-(E)-butenyl 4-diphosphate into isopentenyl diphosphate (IPP) and dimethylallyl diphosphate (DMAPP). Is essential for chloroplast development. {ECO:0000250|UniProtKB:Q94B35}.	PATHWAY: Isoprenoid biosynthesis; dimethylallyl diphosphate biosynthesis; dimethylallyl diphosphate from (2E)-4-hydroxy-3-methylbutenyl diphosphate: step 1/1. {ECO:0000305}.; PATHWAY: Isoprenoid biosynthesis; isopentenyl diphosphate biosynthesis via DXP pathway; isopentenyl diphosphate from 1-deoxy-D-xylulose 5-phosphate: step 6/6. {ECO:0000305}.			chloroplast stroma [GO:0009570]; 4 iron, 4 sulfur cluster binding [GO:0051539]; 4-hydroxy-3-methylbut-2-en-1-yl diphosphate reductase activity [GO:0051745]; metal ion binding [GO:0046872]; dimethylallyl diphosphate biosynthetic process [GO:0050992]; isopentenyl diphosphate biosynthetic process, methylerythritol 4-phosphate pathway [GO:0019288]	GO:0009570; GO:0019288; GO:0046872; GO:0050992; GO:0051539; GO:0051745
MYB73_ARATH	O23160	MYB73_ARATH	Transcription factor MYB73 (Myb-related protein 73) (AtMYB73)	MYB73 At4g37260 AP22.97 C7A10.100	Arabidopsis thaliana (Mouse-ear cress)	320	FUNCTION: Transcription factor that functions in salt stress response. Acts as negative regulator of NHX7/SOS1 and CBL4/SOS3 induction in response to salt stress (PubMed:23809151). In response to auxin, activates the transcription of the auxin-responsive gene IAA19. The IAA19 transcription activation by MYB73 is enhanced by direct interaction between MYB73 and PYL8 (PubMed:24894996). {ECO:0000269|PubMed:23809151, ECO:0000269|PubMed:24894996}.				nucleus [GO:0005634]; DNA-binding transcription factor activity [GO:0003700]; DNA-binding transcription factor activity, RNA polymerase II-specific [GO:0000981]; RNA polymerase II cis-regulatory region sequence-specific DNA binding [GO:0000978]; transcription cis-regulatory region binding [GO:0000976]; glucosinolate metabolic process [GO:0019760]; negative regulation of response to salt stress [GO:1901001]; positive regulation of auxin mediated signaling pathway [GO:0010929]; regulation of DNA-templated transcription [GO:0006355]	GO:0000976; GO:0000978; GO:0000981; GO:0003700; GO:0005634; GO:0006355; GO:0010929; GO:0019760; GO:1901001
PTR53_ARATH	Q9LV10	PTR53_ARATH	Protein NRT1/ PTR FAMILY 2.11 (AtNPF2.11) (Nitrate transporter 1.10) (Protein GLUCOSINOLATE TRANSPORTER-2)	NPF2.11 GTR2 NRT1.10 At5g62680 MRG21.10	Arabidopsis thaliana (Mouse-ear cress)	616	FUNCTION: High-affinity, proton-dependent glucosinolate-specific transporter. Involved in apoplasmic phloem-loading of glucosinolates and in bidirectional long-distance transport of aliphatic but not indole glucosinolates. May be involved in removal of glucosinolates from the xylem in roots. {ECO:0000269|PubMed:22864417, ECO:0000269|PubMed:23995084}.			TISSUE SPECIFICITY: Expressed in roots. Detected in shoots, stems and flowers. Expressed in veins and in the root vasculature with highest expression in lateral branching points. {ECO:0000269|PubMed:17481610, ECO:0000269|PubMed:22864417, ECO:0000269|PubMed:23995084}.	plasma membrane [GO:0005886]; plasmodesma [GO:0009506]; glucosinolate:proton symporter activity [GO:0090448]; transmembrane transporter activity [GO:0022857]; glucosinolate transport [GO:1901349]; phloem glucosinolate loading [GO:0090449]; transmembrane transport [GO:0055085]	GO:0005886; GO:0009506; GO:0022857; GO:0055085; GO:0090448; GO:0090449; GO:1901349
LIP5_ARATH	Q9SZ15	LIP5_ARATH	Protein HOMOLOG OF MAMMALIAN LYST-INTERACTING PROTEIN 5 (Protein EXTENSIN-LIKE) (EXT-LIKE)	LIP5 VTA1 At4g26750 F10M23.90	Arabidopsis thaliana (Mouse-ear cress)	421	FUNCTION: Involved in the endosomal multivesicular bodies (MVB) pathway. MVBs contain intraluminal vesicles (ILVs) that are generated by invagination and scission from the limiting membrane of the endosome and are delivered to lysosomes enabling degradation of membrane proteins (By similarity). Thought to be a cofactor of SKD1/VPS4, which catalyzes the disassembly of membrane-associated ESCRT-III (PubMed:17468262). Target of pathogen-responsive mitogen-activated protein kinases (MPKs) that plays a critical role in plant basal resistance to Pseudomonas syringae in a SKD1-dependent manner by promoting multivesicular bodies (MVBs) trafficking upon plant infection (PubMed:25010425). {ECO:0000250, ECO:0000269|PubMed:17468262, ECO:0000269|PubMed:25010425}.				cytoplasm [GO:0005737]; endosome membrane [GO:0010008]; multivesicular body [GO:0005771]; nucleus [GO:0005634]; protein homodimerization activity [GO:0042803]; defense response to other organism [GO:0098542]; late endosome to vacuole transport via multivesicular body sorting pathway [GO:0032511]; mucilage extrusion from seed coat [GO:0080001]; positive regulation of defense response to bacterium [GO:1900426]; protein transport [GO:0015031]; regulation of vacuolar transport [GO:1903335]; vesicle-mediated transport [GO:0016192]	GO:0005634; GO:0005737; GO:0005771; GO:0010008; GO:0015031; GO:0016192; GO:0032511; GO:0042803; GO:0080001; GO:0098542; GO:1900426; GO:1903335
NEN1_ARATH	Q9FLR0	NEN1_ARATH	Protein NEN1 (NAC45/NAC86-dependent exonuclease-domain protein 1) (EC 3.1.11.-)	NEN1 At5g07710 MBK20.17	Arabidopsis thaliana (Mouse-ear cress)	468	FUNCTION: Probable exonuclease involved in enuclation of sieve elements. {ECO:0000305|PubMed:25081480}.			TISSUE SPECIFICITY: Expressed in the sieve elements and phloem pole pericycle cells. {ECO:0000269|PubMed:25081480}.	cytoplasm [GO:0005737]; nucleus [GO:0005634]; 3'-5' exonuclease activity [GO:0008408]; metal ion binding [GO:0046872]; nucleic acid binding [GO:0003676]	GO:0003676; GO:0005634; GO:0005737; GO:0008408; GO:0046872
NEN3_ARATH	Q9CA74	NEN3_ARATH	Protein NEN3 (NAC45/NAC86-dependent exonuclease-domain protein 3) (EC 3.1.11.-)	NEN3 At1g74390 F1M20.7	Arabidopsis thaliana (Mouse-ear cress)	506	FUNCTION: Probable exonuclease that may be involved in enuclation of sieve elements. {ECO:0000305|PubMed:25081480}.				3'-5' exonuclease activity [GO:0008408]; metal ion binding [GO:0046872]; nucleic acid binding [GO:0003676]	GO:0003676; GO:0008408; GO:0046872
PGLR_BRANA	P35337	PGLR_BRANA	Polygalacturonase (PG) (EC 3.2.1.15) (Pectinase)		Brassica napus (Rape)	397	FUNCTION: May function in depolymerizing pectin during pollen development, germination, and tube growth.			TISSUE SPECIFICITY: Pollen.	extracellular region [GO:0005576]; polygalacturonase activity [GO:0004650]; carbohydrate metabolic process [GO:0005975]; cell wall organization [GO:0071555]	GO:0004650; GO:0005576; GO:0005975; GO:0071555
PGLR_OENOR	P24548	PGLR_OENOR	Exopolygalacturonase (ExoPG) (EC 3.2.1.67) (Galacturan 1,4-alpha-galacturonidase) (Pectinase)		Oenothera organensis (Evening primrose)	362	FUNCTION: May function in depolymerizing pectin during pollen development, germination, and tube growth. Acts as an exo-polygalacturonase.		DEVELOPMENTAL STAGE: Accumulates late in pollen development and/or during germination and tube growth.	TISSUE SPECIFICITY: Pollen tubes growing through the style during pollination.	extracellular region [GO:0005576]; galacturan 1,4-alpha-galacturonidase activity [GO:0047911]; polygalacturonase activity [GO:0004650]; carbohydrate metabolic process [GO:0005975]; cell wall organization [GO:0071555]	GO:0004650; GO:0005576; GO:0005975; GO:0047911; GO:0071555
SAP8_ORYSI	A2YEZ6	SAP8_ORYSI	Zinc finger A20 and AN1 domain-containing stress-associated protein 8 (OsSAP8) (Stress-associated protein 3)	SAP8 SAP3 OsI_022889	Oryza sativa subsp. indica (Rice)	171	FUNCTION: May be involved in environmental stress response. {ECO:0000250}.				DNA binding [GO:0003677]; zinc ion binding [GO:0008270]	GO:0003677; GO:0008270
AB9C_ARATH	Q9M1C7	AB9C_ARATH	ABC transporter C family member 9 (ABC transporter ABCC.9) (AtABCC9) (EC 7.6.2.2) (ATP-energized glutathione S-conjugate pump 9) (Glutathione S-conjugate-transporting ATPase 9) (Multidrug resistance-associated protein 9)	ABCC9 MRP9 At3g60160 T2O9.140	Arabidopsis thaliana (Mouse-ear cress)	1506	FUNCTION: Pump for glutathione S-conjugates. {ECO:0000250}.			TISSUE SPECIFICITY: Ubiquitous. {ECO:0000269|PubMed:12430019}.	membrane [GO:0016020]; plasmodesma [GO:0009506]; ABC-type xenobiotic transporter activity [GO:0008559]; ATP binding [GO:0005524]; ATP hydrolysis activity [GO:0016887]; ATPase-coupled transmembrane transporter activity [GO:0042626]; response to nematode [GO:0009624]; transmembrane transport [GO:0055085]	GO:0005524; GO:0008559; GO:0009506; GO:0009624; GO:0016020; GO:0016887; GO:0042626; GO:0055085
SUI1_SALBA	O48650	SUI1_SALBA	Protein translation factor SUI1 homolog		Salix bakko (Japanese willow)	113	FUNCTION: Probably involved in translation.				translation initiation factor activity [GO:0003743]	GO:0003743
AX22D_VIGRR	O24542	AX22D_VIGRR	Auxin-induced protein 22D (Indole-3-acetic acid-induced protein ARG13)	AUX22D ARG13	Vigna radiata var. radiata (Mung bean) (Phaseolus aureus)	193	FUNCTION: Aux/IAA proteins are short-lived transcriptional factors that function as repressors of early auxin response genes at low auxin concentrations. Repression is thought to result from the interaction with auxin response factors (ARFs), proteins that bind to the auxin-responsive promoter element (AuxRE). Formation of heterodimers with ARF proteins may alter their ability to modulate early auxin response genes expression (By similarity). {ECO:0000250}.				nucleus [GO:0005634]; auxin-activated signaling pathway [GO:0009734]; regulation of DNA-templated transcription [GO:0006355]	GO:0005634; GO:0006355; GO:0009734
Y2309_ARATH	O64818	Y2309_ARATH	Uncharacterized protein At2g23090	At2g23090 F21P24.15	Arabidopsis thaliana (Mouse-ear cress)	78						
